custom_id,sec_code,sec_name,announcement_id,source_run_name,chunk_index,chunk_count,chunk_file,chunk_token_proxy,chunk_chars,chunk_compact_chars,summary_compact_chars,summary_chars,summary_text,summary_token_proxy,sentence_count,sentence_count_reported,sentence_count_mismatch,n0,n1,n2,n3,n4,n5,high_score_count,high_score_share,summary_sentence_count,summary_high_score_gap,relevant_score,relevant_score_model,Redundancy_chunk,innovation_terms_all_union,innovation_terms_without_target,innovation_rate_all_union,innovation_rate_without_target
688021_1207048360_tok_chunk_0001,688021,奥福环保,1207048360,star_token_proxy_150_20260630,1,15,results/star_token_proxy_250_late50_20260702/chunks/688021_1207048360_tok_chunk_0001.txt,3966,9069,7932,325.0,325.0,公司专注蜂窝陶瓷技术研发应用，主要产品为直通式载体、DPF、节能蓄热体及以蜂窝陶瓷为核心部件的RTO、RCO等VOCs废气处理设备，应用于柴油车尾气处理及石化、印刷、医药、电子等行业废气治理。发行人持续承担“十一五”至“十三五”汽车尾气污染治理国家863计划和国家重点研发计划关键课题，自主研发大尺寸蜂窝陶瓷载体，打破国外垄断并填补国内空白。截至2019年8月23日，公司已有147项国六等排放标准测试项目，产品供应优美科、庄信万丰、巴斯夫等催化剂厂商，并进入中国重汽、潍柴动力、玉柴动力、康明斯、戴姆勒等供应商名录。公司VOCs设备相关技术被环保部、科技部评定为先进技术，服务中石化、中石油、齐鲁制药等客户，主营业务自2009年成立以来未重大变化。,163.0,86.0,86.0,0.0,12.0,50.0,8.0,7.0,6.0,3.0,9.0,0.1046511627906976,4.0,-5.0,1.4651162790697674,,24.33128834355828,100,35,25.214321734745337,8.825012607160867
688021_1207048360_tok_chunk_0002,688021,奥福环保,1207048360,star_token_proxy_150_20260630,2,15,results/star_token_proxy_250_late50_20260702/chunks/688021_1207048360_tok_chunk_0002.txt,3990,8879,7980,321.0,321.0,柴油车国六阶段需在国五基础上加装DPF，重型柴油车需大尺寸高规格蜂窝陶瓷载体组成处理系统以处理NOx、PM、CO、HC及NH3等污染物。公司研发带头人参与863重点攻关课题并攻克大尺寸蜂窝陶瓷载体技术，发行人完成产业化建设，相关成果被评定为打破国外垄断、填补国内空白，发行人及潘吉庆作为第三完成单位及个人获国家科学技术进步二等奖。发行人自主构建以堇青石材料结构及结晶控制技术、高性能蜂窝陶瓷载体制备工艺技术为核心的技术和生产体系，掌握大尺寸载体从配方、模具到烧成控制的规模化生产关键技术。国六柴油车采用DOC-DPF-SCR-ASC路线，DPF捕集效率高达95%，SCR还原NOx效率高达95%，公司聚焦柴油车大尺寸载体，与国六技术路线匹配。,161.0,92.0,92.0,0.0,9.0,58.0,9.0,7.0,6.0,3.0,9.0,0.0978260869565217,4.0,-5.0,1.4782608695652173,,24.782608695652176,97,36,24.31077694235589,9.022556390977444
688021_1207048360_tok_chunk_0003,688021,奥福环保,1207048360,star_token_proxy_150_20260630,3,15,results/star_token_proxy_250_late50_20260702/chunks/688021_1207048360_tok_chunk_0003.txt,3935,8751,7870,340.0,340.0,公司自2009年成立以来专注蜂窝陶瓷技术，产品从节能蓄热体延伸至技术要求更高的内燃机尾气处理催化剂载体，并选择柴油车蜂窝陶瓷载体作为主要产品。发行人研发带头人参与863课题并攻克大尺寸蜂窝陶瓷载体技术，公司完成产业化，相关SCR技术成果被评定为打破国外垄断、填补国内空白，并获国家科学技术进步二等奖。公司抓住柴油车国四、国五排放升级带来的认证窗口，进入整车供应商体系，并因中国重汽等客户需求战略聚焦大尺寸载体。公司VOCs废气处理设备由节能蓄热体衍生，节能蓄热体为RTO、RCO核心部件；公司可量产热膨胀系数≤0.60×10-6/℃、SCR/DOC壁厚≤3mil、目数300-600、DPF过滤效率≥95%、GPF和DPF颗粒捕捉效率≥99%的产品，相关指标符合《指导目录》要求。,170.0,80.0,80.0,0.0,8.0,49.0,8.0,6.0,6.0,3.0,9.0,0.1125,4.0,-5.0,1.525,,23.147058823529413,161,47,40.914866581956794,11.944091486658195
688021_1207048360_tok_chunk_0004,688021,奥福环保,1207048360,star_token_proxy_150_20260630,4,15,results/star_token_proxy_250_late50_20260702/chunks/688021_1207048360_tok_chunk_0004.txt,3930,8788,7859,319.0,319.0,"蜂窝陶瓷载体随排放法规升级迭代加快，重型柴油车SCR载体由国四壁厚7mil、热膨胀系数≤1.25×10-6/℃提升至国六壁厚3-5mil、热膨胀系数≤0.50×10-6/℃，DPF还需满足孔隙率和中值孔径指标。公司SCR载体生产工艺有19道工序、DPF有23道工序，蜂窝陶瓷载体制造涉及材料配比、混料、模具、挤出、干燥、烧成、温场控制等多环节，量产稳定性构成技术壁垒。全球蜂窝陶瓷载体长期由康宁和NGK垄断，二者合计约占全球90%以上市场份额，大尺寸重型柴油车载体格局仍由其主导。公司核心产品蜂窝陶瓷载体处于内燃机尾气后处理产业链前端，国四国五已取得柴油机型式核准证书，2019年1-6月国五大尺寸车用SCR载体收入7,340.59万元。",160.0,84.0,84.0,0.0,8.0,53.0,8.0,6.0,6.0,3.0,9.0,0.1071428571428571,4.0,-5.0,1.5,,24.5625,122,80,31.043256997455472,20.356234096692113
688021_1207048360_tok_chunk_0005,688021,奥福环保,1207048360,star_token_proxy_150_20260630,5,15,results/star_token_proxy_250_late50_20260702/chunks/688021_1207048360_tok_chunk_0005.txt,3844,8853,7687,327.0,327.0,"公司产品用于商用货车中的柴油车，重型商用货车前五大厂商一汽解放、东风汽车、中国重汽、陕汽汽车和福田汽车2015-2017年产量合计占比均超过80%，且均使用发行人产品。国六阶段柴油车需采用DOC+DPF+SCR+ASC路线，重型商用车平均排量10L，对应单车SCR、DOC、DPF使用体积分别为20L、7L、15L。发行人DPF产品2018年开始量产并出口美国汽车后市场，成为AP、Skyline等主要汽车后市场服务商的直接供应商。预计2025年我国汽车行业蜂窝陶瓷载体需求量达26,010万升、市场空间近100亿元，全球汽车市场需求达74,100万升、约250亿元；VOCs设备方面，公司所处行业核心技术包括蓄热燃烧、蓄热催化燃烧及蜂窝陶瓷蓄热体应用。",164.0,89.0,89.0,0.0,10.0,61.0,5.0,4.0,6.0,3.0,9.0,0.1011235955056179,4.0,-5.0,1.3707865168539326,,23.4390243902439,71,20,18.47034339229969,5.202913631633715
688021_1207048360_tok_chunk_0006,688021,奥福环保,1207048360,star_token_proxy_150_20260630,6,15,results/star_token_proxy_250_late50_20260702/chunks/688021_1207048360_tok_chunk_0006.txt,3900,8593,7800,330.0,330.0,国六、非道路第四阶段及船舶排放标准实施将推动蜂窝陶瓷载体需求，并淘汰技术能力较弱厂商；康宁和NGK长期占据全球约90%市场份额，国内载体厂商国产替代进程加快。发行人蜂窝陶瓷载体国内市场占有率上升，装载公司SCR载体的商用货车占我国商用货车比例由2016年3.50%升至2018年9.49%，装载公司大尺寸SCR载体的重型商用货车占比2016-2018年分别为10.13%、17.24%、16.85%。截至2016年2月17日国五压燃式发动机型式核准证书统计，公司取得42个，仅次于NGK的184个和康宁的70个，位于国内载体厂商首位。公司下游包括机动车、船舶、非道路移动机械及石化、化学、印刷、汽车制造、医药等VOCs设备客户，国六及VOCs监管趋严扩大需求。,165.0,95.0,95.0,0.0,8.0,58.0,8.0,8.0,9.0,4.0,13.0,0.1368421052631579,5.0,-8.0,1.6210526315789473,,23.636363636363637,114,48,29.23076923076923,12.307692307692308
688021_1207048360_tok_chunk_0007,688021,奥福环保,1207048360,star_token_proxy_150_20260630,7,15,results/star_token_proxy_250_late50_20260702/chunks/688021_1207048360_tok_chunk_0007.txt,3851,8813,7701,373.0,374.0,康宁2018年环境科技产品收入12.89亿美元，NGK 2017年收入41.01亿美元，二者为全球蜂窝陶瓷载体领导者；公司与其相比产品售价较低，直通式载体价格区间为20-50元/升、壁流式载体为50-100元/升。公司深耕柴油车大尺寸蜂窝陶瓷载体，客户覆盖优美科、庄信万丰、重汽橡塑、贵研催化、中自环保、威孚环保、艾可蓝等主要催化剂厂商，国五压燃式发动机型式核准证书42个、国六重型燃气车型式检验公告车型14个。技术指标方面，公司直通式载体热膨胀系数最优0.16×10-6℃-1、壁厚3mil，DPF热膨胀系数0.27×10-6℃-1、壁厚9mil、背压8.9in.H2O，GPF热膨胀系数0.44×10-6℃-1、抗热震稳定性750℃。公司大尺寸SCR及DPF核心指标与国外竞争对手处于同一水平，发行人蜂窝陶瓷载体技术被概括为国内领先、国际先进。,187.0,92.0,92.0,0.0,8.0,28.0,12.0,11.0,22.0,11.0,33.0,0.358695652173913,5.0,-28.0,2.4782608695652173,,20.593582887700535,136,76,35.315502466891715,19.735133731498312
688021_1207048360_tok_chunk_0008,688021,奥福环保,1207048360,star_token_proxy_150_20260630,8,15,results/star_token_proxy_250_late50_20260702/chunks/688021_1207048360_tok_chunk_0008.txt,3956,8746,7911,424.0,424.0,"公司2018年主营业务收入24,827.21万元，其中VOCs废气处理设备业务收入5,682.12万元，主要产品包括工业VOCs、NOx等废气处理RTO、RCO设备。公司截至2019年6月30日有研发人员75人，占总人数13.37%，已结题或参与“十一五”至“十三五”国家863计划和国家重点研发计划课题11项。公司掌握堇青石材料合成与晶体生长控制、SCR/DPF/DOC大载体配方、DPF非对称孔结构大载体配方、GPF配方、模具设计制造和窑炉温度自动控制及烧成技术，关键指标达到国际先进水平。公司2016年自建25,000m3/h工业窑炉废气处理工程采用的旋转式蓄热燃烧净化技术入选环保部2016年国家先进污染防治技术目录。公司参与的“重型柴油车污染排放控制高效SCR技术研发及产业化”获2014年国家科学技术进步二等奖，大尺寸SCR载体报告期收入占营业收入49.98%-76.06%，2019年1-6月收入7,404.18万元、占56.55%。",212.0,91.0,91.0,0.0,7.0,19.0,8.0,13.0,28.0,16.0,44.0,0.4835164835164835,5.0,-39.0,2.923076923076923,,18.660377358490567,405,144,102.37613751263903,36.400404448938325
688021_1207048360_tok_chunk_0009,688021,奥福环保,1207048360,star_token_proxy_150_20260630,9,15,results/star_token_proxy_250_late50_20260702/chunks/688021_1207048360_tok_chunk_0009.txt,3853,8739,7705,271.0,271.0,"奥福环保与优美科、庄信万丰、巴斯夫等外资催化剂厂商及重汽橡塑、威孚环保、中自环保、贵研催化、艾可蓝等国内配套企业建立长期合作，并进入中国重汽、潍柴动力、玉柴动力、康明斯、戴姆勒等供应商名录。公司VOCs设备已布局石化、化学、印刷、环保、汽车制造、医药等行业，客户包括中石化、中石油、索通发展、信立泰等。公司蜂窝陶瓷载体2019年1-6月产能367.50万升、销量328.16万升，2018年收入18,147.70万元、占主营73.21%，2019年1-6月收入占比升至90.95%；前五大客户销售7,916.42万元、占营业收入60.46%。",136.0,72.0,72.0,0.0,10.0,9.0,16.0,25.0,10.0,2.0,12.0,0.1666666666666666,3.0,-9.0,2.3055555555555554,,28.330882352941178,102,31,26.47287827666753,8.045678691928368
688021_1207048360_tok_chunk_0010,688021,奥福环保,1207048360,star_token_proxy_150_20260630,10,15,results/star_token_proxy_250_late50_20260702/chunks/688021_1207048360_tok_chunk_0010.txt,3960,9534,7920,272.0,272.0,"报告期内发行人前五大客户较稳定，2018年前五大客户销售15,178.85万元、占61.14%，2017年为15,530.16万元、占79.19%，2016年为6,297.83万元、占67.81%。蜂窝陶瓷载体主要客户与公司长期合作，2019年1-6月优美科、重汽橡塑、中自环保、庄信万丰、潍柴净化分别采购111.05万升、68.77万升、22.88万升、19.62万升、25.17万升。公司向主要客户销售金额远低于客户营业收入，采购规模与经营规模相符；蜂窝陶瓷载体客户基本每月下达1-2次订单，VOCs设备按产线环保需求采购、交易连续性较弱。",136.0,85.0,85.0,0.0,8.0,12.0,18.0,28.0,16.0,3.0,19.0,0.2235294117647059,3.0,-16.0,2.4823529411764707,,29.11764705882353,58,10,14.646464646464647,2.5252525252525255
688021_1207048360_tok_chunk_0011,688021,奥福环保,1207048360,star_token_proxy_150_20260630,11,15,results/star_token_proxy_250_late50_20260702/chunks/688021_1207048360_tok_chunk_0011.txt,3961,9327,7921,292.0,292.0,"节能蓄热体客户以钢厂为主，2018年公司向江苏沙钢集团销售496.02万元，而其当年收入2,410亿元，采购规模与经营规模相符；钢厂热工设备通常2-4个月检修更换，蓄热体采购周期与生产特点相符。新增主要客户中，中自环保2019年1-6月采购蜂窝陶瓷载体655.38万元、占营业收入5.01%；优美科2017年和2018年分别采购5,004.87万元、3,751.78万元。公司主要原材料包括滑石、氧化铝、高岭土、纤维素、钢材、燃烧器、保温棉，2019年1-6月前五大供应商采购额3,293.41万元、占46.21%。核心原材料单价整体上升，国五、国六产品研发和备料推动高性能原料采购。",146.0,91.0,91.0,0.0,8.0,13.0,20.0,27.0,19.0,4.0,23.0,0.2527472527472527,4.0,-19.0,2.5274725274725274,,27.13013698630137,65,5,16.409997475385005,1.2623074981065388
688021_1207048360_tok_chunk_0012,688021,奥福环保,1207048360,star_token_proxy_150_20260630,12,15,results/star_token_proxy_250_late50_20260702/chunks/688021_1207048360_tok_chunk_0012.txt,3977,9939,7954,255.0,255.0,"报告期内发行人与前五大供应商、客户无关联关系，相关董事、监事、高级管理人员、核心人员、主要关联方及5%以上股东未在上述供应商或客户中占有权益。截至报告期末，公司固定资产原值24,504.05万元，账面价值18,415.80万元，成新率75.15%，其中房屋建筑物账面价值10,835.35万元、机器设备6,993.62万元。主要设备包括91台窑炉、16台挤出机、3台打孔机、31台模具加工机床等，服务于蜂窝陶瓷载体烧制、成型、DPF打孔和模具制作；公司及子公司拥有多处生产房屋和土地，部分资产用于银行借款抵押。",128.0,76.0,76.0,0.0,7.0,10.0,20.0,23.0,14.0,2.0,16.0,0.2105263157894736,3.0,-13.0,2.4342105263157894,,31.0703125,81,52,20.36711088760372,13.075182298214735
688021_1207048360_tok_chunk_0013,688021,奥福环保,1207048360,star_token_proxy_150_20260630,13,15,results/star_token_proxy_250_late50_20260702/chunks/688021_1207048360_tok_chunk_0013.txt,3941,8957,7881,269.0,269.0,"公司核心团队经自主研发掌握以堇青石材料结构及结晶控制技术、高性能蜂窝陶瓷载体制备工艺技术为基础的蜂窝陶瓷载体关键技术，并在VOCs领域掌握回转式RTO转阀制备技术。公司核心技术均为自主研发，关联专利覆盖堇青石蜂窝陶瓷载体生产方法、零烧成收缩制备方法、超大尺寸堇青石载体工艺、催化剂焙烧设备及RTO相关装置等。堇青石控制技术通过原料级配、形貌、烧成曲线和温场控制形成低热膨胀载体；窑炉温场控制可使炉内升至1,400℃以上且温差控制在±2℃内。报告期核心技术产品收入占营业收入比例分别为96.27%、98.94%、99.16%和99.78%。",135.0,78.0,78.0,0.0,9.0,8.0,16.0,22.0,18.0,5.0,23.0,0.2948717948717949,4.0,-19.0,2.602564102564102,,29.192592592592593,242,98,61.40573458513067,24.866785079928952
688021_1207048360_tok_chunk_0014,688021,奥福环保,1207048360,star_token_proxy_150_20260630,14,15,results/star_token_proxy_250_late50_20260702/chunks/688021_1207048360_tok_chunk_0014.txt,3983,9389,7965,282.0,282.0,截至报告期末，公司在研项目覆盖国六蜂窝陶瓷载体、GPF、DPF、船机SCR、国产化原料、分子筛转轮、重结晶碳化硅DPF及VOCs设备阀门等方向。低膨胀大尺寸DPF目标包括孔隙率48%至62%、孔径10-20μm、背压达到竞争对手水平、直径≥304.8mm且高度≥254mm产品烧成合格率≥90%。高孔密度超薄壁SCR载体、低膨胀DOC载体等项目已达到性能目标并批量生产，目标包括600/3载体自动窑烧成合格率＞90%、400/4载体挤出效率提高20%。公司参与“十三五”国家重点研发计划，承担大尺寸SCR载体、DPF载体、GPF载体及汽油车GPF生产线建设等任务。,141.0,82.0,82.0,0.0,7.0,10.0,14.0,20.0,23.0,8.0,31.0,0.3780487804878049,4.0,-27.0,2.8048780487804876,,28.24822695035461,249,123,62.51569168968114,30.881245292493098
688021_1207048360_tok_chunk_0015,688021,奥福环保,1207048360,star_token_proxy_150_20260630,15,15,results/star_token_proxy_250_late50_20260702/chunks/688021_1207048360_tok_chunk_0015.txt,2058,4663,4115,280.0,280.0,"公司2019年6月30日拥有核心技术人员4名、研发人员75名，研发人员占员工总数13.37%；近五年核心技术人员未发生变动，并通过薪酬、持股、绩效激励及保密协议维持稳定。报告期研发费用分别为750.86万元、1,178.66万元、1,617.65万元和1,022.33万元，占营业收入比例为8.09%、6.01%、6.52%和7.81%。公司不属于重污染行业，生产污染主要来自粉尘、SO2、NOx、有机废气、焊烟和生活污水，采用除尘器、净化炉、RTO焚烧装置、焊烟净化器和化粪池处理；2019年1-6月环保设施投入34.02万元、环保相关成本179.74万元。",140.0,67.0,67.0,0.0,6.0,9.0,15.0,21.0,13.0,3.0,16.0,0.2388059701492537,3.0,-13.0,2.5223880597014925,,14.7,166,73,80.66083576287659,35.47133138969873
688027_1207992273_tok_chunk_0001,688027,国盾量子,1207992273,star_token_proxy_150_20260630,1,17,results/star_token_proxy_250_late50_20260702/chunks/688027_1207992273_tok_chunk_0001.txt,3826,8655,7651,289.0,289.0,"公司主要从事量子通信产品研发、生产、销售及技术服务，为光纤量子保密通信网络及星地一体广域量子保密通信地面站建设提供软硬件产品，并面向政务、金融、电力、国防等领域提供组网及量子安全应用解决方案。公司掌握自主知识产权的实用化量子保密通信核心技术，拥有国内外量子技术相关专利212项，承担科技部863计划等项目，并牵头或参与多项国际、国家及行业标准。主要产品包括QKD及信道与密钥组网交换产品、量子安全应用产品、核心组件和管控软件；2017-2019年主营业务收入分别为27,248.17万元、25,690.88万元和25,587.18万元，其中量子保密通信产品收入占比均超过93%。",145.0,118.0,118.0,0.0,14.0,22.0,34.0,29.0,16.0,3.0,19.0,0.1610169491525423,3.0,-16.0,2.169491525423729,,26.386206896551723,186,87,48.61474124411919,22.739153162571878
688027_1207992273_tok_chunk_0002,688027,国盾量子,1207992273,star_token_proxy_150_20260630,2,17,results/star_token_proxy_250_late50_20260702/chunks/688027_1207992273_tok_chunk_0002.txt,3885,8765,7769,191.0,191.0,公司主要经营模式报告期内未发生重大变化，采用直销模式，产品定价区间一般为基准定价上下20%以内；QKD产品工艺流程包括电子学单板生产、量子光源和单光子探测器等光学模块生产、整机组装测试、高温老化、系统联调和入库检验。公司所属行业为C39计算机、通信和其他电子设备制造业下的信息安全设备制造，同时属于新一代信息技术产业；生产环节废水、废气、噪声和固废均配置相应处理设施并披露运行良好。,96.0,83.0,83.0,0.0,18.0,45.0,12.0,6.0,2.0,0.0,2.0,0.0240963855421686,2.0,0.0,1.144578313253012,,40.46875,214,76,55.08365508365509,19.562419562419564
688027_1207992273_tok_chunk_0003,688027,国盾量子,1207992273,star_token_proxy_150_20260630,3,17,results/star_token_proxy_250_late50_20260702/chunks/688027_1207992273_tok_chunk_0003.txt,3723,8198,7445,241.0,241.0,"公司已研制基于量子密钥分发技术的量子保密通信网络核心设备，并应用于骨干网、城域网、局域网及政务、金融、电力、国防等示范场景。截至2018年末，我国已建成实用化光纤量子保密通信网络总长7,000余公里，其中超过6,000公里使用公司产品并在线运行，覆盖“京沪干线”“武合干线”及合肥、济南、武汉、北京、上海、贵阳等城域网。金融应用已用于人民银行、工商银行、中国银行、建设银行等机构，电力应用在国家电网灾备中心及山东、安徽、浙江等省电力公司验证；公司还参与产业链合作并推动相关标准制定。",121.0,94.0,94.0,0.0,10.0,55.0,16.0,8.0,4.0,1.0,5.0,0.0531914893617021,3.0,-2.0,1.4042553191489362,,30.768595041322314,151,47,40.558689229116304,12.624227773301103
688027_1207992273_tok_chunk_0004,688027,国盾量子,1207992273,star_token_proxy_150_20260630,4,17,results/star_token_proxy_250_late50_20260702/chunks/688027_1207992273_tok_chunk_0004.txt,3841,8524,7681,246.0,246.0,我国自2017年“京沪干线”建成并与“墨子号”量子科学试验卫星连接后进入广域网阶段，政务、金融、电力等领域开展应用试点，国家广域量子保密通信骨干网和各地城域网继续建设。近十年量子保密通信网络项目中，合肥城域网、济南党政机关专网、京沪干线、武合干线、北京城域网、阿里巴巴OTN量子安全加密通信系统、陆家嘴金融示范网、乌鲁木齐和贵阳城域网等多数项目由公司提供设备。未来技术方向包括星地自由空间通信、高集成度和新型QKD协议，公司已围绕小型化地面站、SOC芯片、光电集成芯片和新型协议适配开展研发。,123.0,101.0,101.0,0.0,12.0,67.0,12.0,6.0,3.0,1.0,4.0,0.0396039603960396,3.0,-1.0,1.2475247524752475,,31.227642276422763,130,37,33.84535277271544,9.632908096849778
688027_1207992273_tok_chunk_0005,688027,国盾量子,1207992273,star_token_proxy_150_20260630,5,17,results/star_token_proxy_250_late50_20260702/chunks/688027_1207992273_tok_chunk_0005.txt,3224,7089,6447,262.0,262.0,"公司是我国量子通信领域市场占有率最高的行业领先企业，截至2018年末，国内已建成实用化光纤量子保密通信网络7,000余公里，其中超过6,000公里使用公司产品；京沪干线、武合干线、北京、济南、合肥、武汉、上海等网络合计部署公司产品光缆皮长6,475公里。公司拥有专利212项、软件著作权195项，牵头或参与国际、国家、密码、通信、金融和电力领域多项标准。公司11项QKD相关核心技术处于国际先进水平，6项数据后处理、密钥管理和量子安全应用技术处于国内先进水平，产品形成网络核心设备、量子安全应用、核心组件和管控软件四大系列。",131.0,106.0,106.0,0.0,9.0,55.0,18.0,12.0,9.0,3.0,12.0,0.1132075471698113,3.0,-9.0,1.679245283018868,,24.610687022900763,182,55,56.45161290322581,17.05955334987593
688027_1207992273_tok_chunk_0006,688027,国盾量子,1207992273,star_token_proxy_150_20260630,6,17,results/star_token_proxy_250_late50_20260702/chunks/688027_1207992273_tok_chunk_0006.txt,3727,8260,7453,290.0,290.0,"与可比量子保密通信企业相比，截至2018年末我国7,000余公里实用化光纤量子保密通信网络中超过6,000公里使用公司产品，公司拥有212项专利、195项软件著作权，并承担863计划、安徽省和山东省相关研发项目。公司主要产品覆盖城域和骨干网QKD、信道与密钥组网交换、量子安全应用、单光子探测器、量子随机数源及管控软件，QKD设备最大衰减24dB，成码率80kbps@10dB、1kbps@24dB，优于可比公司披露的18dB和6kbps@12dB。公司竞争优势包括核心技术、人才、品牌、工程应用和核心组件自主可控，并为“京沪干线”“武合干线”等工程及重大活动保障提供产品和技术。",145.0,93.0,93.0,0.0,8.0,31.0,18.0,18.0,14.0,4.0,18.0,0.1935483870967742,3.0,-15.0,2.118279569892473,,25.70344827586207,279,115,74.85913603434398,30.85591628655755
688027_1207992273_tok_chunk_0007,688027,国盾量子,1207992273,star_token_proxy_150_20260630,7,17,results/star_token_proxy_250_late50_20260702/chunks/688027_1207992273_tok_chunk_0007.txt,3992,8758,7983,292.0,293.0,"公司取得军工相关资质证书、商用密码产品型号证书和CMMI L3证书，产品利用量子密钥分发在通信链路和网络中安全分发密钥，结合抗量子计算对称密码可形成长期安全加密通信方案。公司承认资产和经营规模相对较小、融资渠道单一、国际化程度不高，产品推广周期较长，且MTBF约2万小时，低于传统密码机普遍3万小时水平。公司产品已处于大规模商业化推广阶段，核心专利和关键技术已用于众多量子保密通信网络，并原则上适应绝大多数网络环境；2017-2019年量子保密通信产品收入分别为26,634.58万元、24,615.67万元和23,817.67万元，占比分别为97.75%、95.81%和93.08%。",146.0,72.0,72.0,0.0,6.0,13.0,15.0,15.0,15.0,8.0,23.0,0.3194444444444444,3.0,-20.0,2.611111111111111,,27.34246575342466,104,36,26.052104208416832,9.01803607214429
