custom_id,sec_code,sec_name,announcement_id,source_run_name,chunk_index,chunk_count,chunk_file,chunk_token_proxy,chunk_chars,chunk_compact_chars,summary_compact_chars,summary_chars,summary_text,summary_token_proxy,sentence_count,sentence_count_reported,sentence_count_mismatch,n0,n1,n2,n3,n4,n5,high_score_count,high_score_share,summary_sentence_count,summary_high_score_gap,relevant_score,relevant_score_model,Redundancy_chunk,innovation_terms_all_union,innovation_terms_without_target,innovation_rate_all_union,innovation_rate_without_target
688027_1207992273_tok_chunk_0008,688027,国盾量子,1207992273,star_token_proxy_150_20260630,8,17,results/star_token_proxy_250_late50_20260702/chunks/688027_1207992273_tok_chunk_0008.txt,3940,9554,7879,339.0,339.0,"报告期内，公司与部分主要客户存在参股或共同投资等关系，并披露主要合同付款、交付验收、质量保证和违约责任安排。公司产品相关重大项目中，“京沪干线”总体投资56,515万元，公司销售28,281.48万元，占50.04%；融合量子通信技术专网升级改造投资3,650万元，公司销售1,907.21万元，占52.25%；济南党政机关量子通信专网投资5,990万元，公司销售5,119.66万元，占85.47%；武汉城域网投资14,320万元，公司销售8,144.35万元，占56.87%。国家广域量子保密通信骨干网络一期沪合段、汉广段投资17,255.22万元，公司销售12,620.79万元，占73.14%，公司在上述项目中主要提供QKD、信道与密钥组网交换、管控软件及相关技术服务。",170.0,76.0,76.0,0.0,7.0,7.0,10.0,17.0,25.0,10.0,35.0,0.4605263157894737,3.0,-32.0,3.0,,23.176470588235293,121,73,30.710659898477157,18.52791878172589
688027_1207992273_tok_chunk_0009,688027,国盾量子,1207992273,star_token_proxy_150_20260630,9,17,results/star_token_proxy_250_late50_20260702/chunks/688027_1207992273_tok_chunk_0009.txt,3861,8673,7721,289.0,289.0,"2019年发行人继续参与量子保密通信网络项目，向江宁政务网、金华城域网、重要城市用户接入、省会及长三角区域项目等提供QKD产品、信道与密钥组网交换产品、管控软件等，多个项目销售金额占投资比例约50%-88%。报告期内公司业绩对骨干网、城域网建设存在重大依赖，但已在政务、金融、电力、国防等领域形成示范应用。国家广域量子骨干网一期沪合段、汉广段2018年确认收入14,037.94万元、毛利10,951.22万元，2018年12月底确认收入12,620.79万元；发行人共销售344台QKD设备及配套产品，2018年12月神州数码新增采购316台QKD设备，采购规模符合设计方案。",145.0,78.0,78.0,0.0,10.0,18.0,11.0,21.0,14.0,4.0,18.0,0.2307692307692307,3.0,-15.0,2.2948717948717947,,26.627586206896552,89,56,23.05102305102305,14.504014504014505
688027_1207992273_tok_chunk_0010,688027,国盾量子,1207992273,star_token_proxy_150_20260630,10,17,results/star_token_proxy_250_late50_20260702/chunks/688027_1207992273_tok_chunk_0010.txt,3960,9074,7920,268.0,268.0,"发行人说明神州数码2018年12月集中采购、交付1.46亿元量子通信设备符合其报告期内骨干网、城域网项目集中采购惯例，并与沪合段、汉广段跨多省约2,100公里光纤、数十机房同步实施需求相匹配。该批设备集中交付后取得验收，发行人按合同交付、风险报酬转移、收入金额可计量、客户确认和成本可计量等条件确认收入。国家广域量子骨干网一期项目中，神州数码最大毛利约1,200万元、毛利率8%，发行人获取毛利10,951.22万元、毛利率78.01%；双方约定发行人不承担安装调试义务，并按交货、验收满9个月、保修期满收取30%、60%、10%货款。",134.0,65.0,65.0,0.0,8.0,10.0,12.0,21.0,12.0,2.0,14.0,0.2153846153846154,3.0,-11.0,2.3846153846153846,,29.55223880597015,114,77,28.78787878787879,19.444444444444446
688027_1207992273_tok_chunk_0011,688027,国盾量子,1207992273,star_token_proxy_150_20260630,11,17,results/star_token_proxy_250_late50_20260702/chunks/688027_1207992273_tok_chunk_0011.txt,3824,9012,7647,330.0,330.0,"报告期内发行人主要业务合同多通过商务谈判、单一来源采购和少量公开招投标取得，其中2018年12月与神州数码签订88,033,000元和58,368,200元合同，2019年12月又与神州数码签订多笔2,339.98万元至5,210.63万元合同。发行人参与并中标浙商银行量子加密通信设备采购、北京信息科技大学量子通信应用研究、北京和合肥城域网集控站B项目、小型化量子通信卫星地面站系统及量子卫星地面站量子密钥分发数据处理系统等项目。2017-2019年神州数码均为重要客户，销售额分别为5,996.50万元、15,325.27万元、15,346.42万元，占营业收入21.14%、57.90%、59.52%；2019年末对其应收账款余额15,966.58万元。",165.0,58.0,58.0,0.0,7.0,8.0,11.0,20.0,10.0,2.0,12.0,0.2068965517241379,3.0,-9.0,2.413793103448276,,23.175757575757576,113,22,29.55020920502092,5.7531380753138075
688027_1207992273_tok_chunk_0012,688027,国盾量子,1207992273,star_token_proxy_150_20260630,12,17,results/star_token_proxy_250_late50_20260702/chunks/688027_1207992273_tok_chunk_0012.txt,3986,9388,7972,312.0,312.0,"发行人部分前五大供应商为贸易商，采购内容包括调制器驱动器、FPGA、逻辑芯片、机箱、电源模块及通用通信设备等；发行人选择贸易商主要因原材料品类多、单项规模小、部分厂商通过区域代理供货，以及项目实施地点和交付时效需要。公司建立供应商准入、初评、现场考察、物资检验、评审和审后管理流程，由供应商管理小组负责并录入ERP维护。2019年末公司固定资产账面原值18,814.13万元、账面价值12,260.06万元，其中机器及专用设备账面原值12,036.65万元。公司拥有土地使用权1宗、专利212项、软件著作权195项、注册商标37个；量子密钥管理机于2019年7月31日获商用密码产品型号证书，高速偏振编码QKD产品仍在测试。",156.0,70.0,70.0,0.0,7.0,11.0,17.0,24.0,9.0,2.0,11.0,0.1571428571428571,4.0,-7.0,2.3285714285714287,,25.55128205128205,115,59,28.8509784244857,14.801806322127446
688027_1207992273_tok_chunk_0013,688027,国盾量子,1207992273,star_token_proxy_150_20260630,13,17,results/star_token_proxy_250_late50_20260702/chunks/688027_1207992273_tok_chunk_0013.txt,3539,8517,7078,289.0,289.0,发行人列示17项核心技术，覆盖QKD注入锁定光源及编码、偏振编码调制、自稳定强度调制、信道波分复用、信道自适应、系统同步、偏振反馈控制、上转换单光子探测、探测器高速精密控制、数据后处理、终端集成、规模化组网、量子密钥管理和量子安全服务平台等，技术来源均为自主创新，多项达到国际先进。核心技术广泛应用于QKD全系列产品、偏振编码系列、波分复用产品、量子密钥管理机、量子VPN、量子加密路由器和QSS系列产品。研发成果包括第一代集成QKD终端、世界首个规模化城域网40用户节点、1.25GHz单光子探测器原型、PPLN波导转换效率99.9%、高速偏振反馈和量子通信设备芯片集成化等。,145.0,45.0,45.0,0.0,4.0,6.0,7.0,10.0,14.0,4.0,18.0,0.4,3.0,-15.0,2.8,,24.406896551724138,269,93,76.01017236507488,26.2786097767731
688027_1207992273_tok_chunk_0014,688027,国盾量子,1207992273,star_token_proxy_150_20260630,14,17,results/star_token_proxy_250_late50_20260702/chunks/688027_1207992273_tok_chunk_0014.txt,3991,9480,7981,331.0,331.0,发行人认为核心技术先进性主要体现在QKD设备工作距离、成码率和量子保密通信组网能力。公司QKD设备可在24dB衰减条件下工作，京沪干线多个相邻站点衰减大于20dB、最大距离超过89km；可比企业最大工作衰减为18dB，欧洲SECOQC网络实际部署最大距离为85km，2014年和2016年200km、404km光纤MDI-QKD实验均基于公司QKD设备。组网方面，公司产品应用于京沪干线及北京、上海、济南、合肥城域网，并通过“墨子号”连接乌鲁木齐城域网和四个地面站，互联节点数大于70个、管理运行QKD设备大于400台。2019年末公司有未结项在研项目18项、已结项57项，研发方向包括星地小型化地面站、芯片集成化、新型协议与密码资质、产品解决方案和标准化研究。,166.0,56.0,56.0,0.0,5.0,6.0,8.0,13.0,17.0,7.0,24.0,0.4285714285714285,4.0,-20.0,2.9285714285714284,,24.042168674698797,270,100,67.65221748935105,25.056376847907792
688027_1207992273_tok_chunk_0015,688027,国盾量子,1207992273,star_token_proxy_150_20260630,15,17,results/star_token_proxy_250_late50_20260702/chunks/688027_1207992273_tok_chunk_0015.txt,3655,8606,7309,302.0,302.0,截至2019年末，发行人已结项研发项目覆盖上转换探测器升级、量子密钥系列产品信息安全资质认证、微纳卫星量子密钥分发接收终端、量子安全服务平台、量子金融数据密码机、小型化产品、QKD产品升级、高速量子密钥生成终端、复杂信道量子保密通信装备等。部分项目形成直接产品或平台成果，如量子金融数据密码机、量子密钥管理平台、量子安全数据库、QRNG-PHF量子随机数发生器、基于上转换探测器的高速QKD系统、经典-量子波分复用产品和干线QKD系统升级。发行人合作研发较少，主要源于共同发明或科研项目协作；17项核心技术中仅PPLN波导制备工艺及上转换单光子探测技术直接相关授权专利来自合作研发，其余主要来自自主研发。,151.0,46.0,46.0,0.0,5.0,5.0,7.0,15.0,11.0,3.0,14.0,0.3043478260869565,3.0,-11.0,2.6739130434782608,,24.205298013245034,369,160,100.95759233926128,43.77564979480164
688027_1207992273_tok_chunk_0016,688027,国盾量子,1207992273,star_token_proxy_150_20260630,16,17,results/star_token_proxy_250_late50_20260702/chunks/688027_1207992273_tok_chunk_0016.txt,3991,8934,7982,356.0,356.0,"发行人建立研发项目人员、物资和财务管理机制，按研发项目核算支出，并通过RDM、OA和ERP系统跟踪项目进展、审批节点及费用归集；会计师出具内控鉴证报告，认为2019年12月31日财务报告相关内控在重大方面有效。2017-2019年研发投入分别为7,344.36万元、9,620.95万元、7,593.93万元，占营业收入25.89%、36.35%、29.45%，三年累计占比30.46%，高于同行业可比上市公司平均水平。2019年研发投入中职工薪酬4,430.76万元、材料费1,167.96万元、其他费用1,344.09万元；2019年末研发设备账面原值3,778.72万元。公司研发人员193人，占员工总数45.41%，核心技术人员9人，覆盖理论研究、系统设计、光学、电子学与集成电路、硬件逻辑和软件等方向。",178.0,59.0,59.0,0.0,5.0,6.0,9.0,18.0,15.0,6.0,21.0,0.3559322033898305,4.0,-17.0,2.847457627118644,,22.421348314606742,406,117,101.72889000250564,29.315960912052116
688027_1207992273_tok_chunk_0017,688027,国盾量子,1207992273,star_token_proxy_150_20260630,17,17,results/star_token_proxy_250_late50_20260702/chunks/688027_1207992273_tok_chunk_0017.txt,2129,4521,4257,318.0,319.0,公司建立总工办、前沿技术研究院、QKD产品线和应用产品线等研发机构，拥有安徽省认定企业技术中心、安徽省量子信息工程技术研究中心，并以ISO9001质量管理体系及CMMI L3为基础组织研发流程。公司已掌握具有自主知识产权的实用化量子保密通信核心技术，产品应用于京沪干线、武合干线及上海、北京、合肥、济南、武汉等量子保密通信网络，并进入政务、金融、电力等示范应用项目。近三年公司主营业务收入均在2亿元以上，收入来源于依托核心技术形成的产品和服务。公司及山东量科、广东国盾通过GB/T19001-2016/ISO9001:2015质量管理体系认证，2019年1月公司取得安全生产标准化二级企业证书，报告期内未发生重大环保、安全或产品质量处罚。,159.0,58.0,58.0,0.0,8.0,20.0,12.0,9.0,7.0,2.0,9.0,0.1551724137931034,4.0,-5.0,1.8793103448275863,,13.38993710691824,311,102,146.07797087834663,47.909816815406295
