custom_id,sec_code,sec_name,announcement_id,source_run_name,chunk_index,chunk_count,chunk_file,chunk_token_proxy,chunk_chars,chunk_compact_chars,summary_compact_chars,summary_chars,summary_text,summary_token_proxy,sentence_count,sentence_count_reported,sentence_count_mismatch,n0,n1,n2,n3,n4,n5,high_score_count,high_score_share,summary_sentence_count,summary_high_score_gap,relevant_score,relevant_score_model,Redundancy_chunk,innovation_terms_all_union,innovation_terms_without_target,innovation_rate_all_union,innovation_rate_without_target
688278_1207242804_tok_chunk_0023,688278,特宝生物,1207242804,star_token_proxy_150_20260630,23,28,results/star_token_proxy_250_late50_20260702/chunks/688278_1207242804_tok_chunk_0023.txt,3914,8657,7828,299,301,发行人申报聚乙二醇修饰重组蛋白质药物5个，全部取得临床批件，其中派格宾已上市。慢性乙肝临床治愈注册临床试验计划纳入400例患者，其中核苷经治优势患者240例。OSST研究总体临床治愈率8.5%，优势患者治愈率22.2%-71.4%；New Switch研究总体20.7%，优势患者40.5%-58.7%。ICURE、Anchor A、Pyramid等研究中优势患者治愈率分别为66.67%、35.29%、20.6%-57.1%。YPEG-G-CSF属于长效重组人粒细胞刺激因子药物，2017年国内重组人粒细胞刺激因子制剂销售规模约34.71亿元。发行人预计YPEG-G-CSF可能于2021年获批上市。,150,56,56,0,3,4,7,11,22,9,31,0.5535714285714286,6,-25,3.2857142857142856,,26.093333333333334,245,100,62.59580991313235,25.549310168625446
688278_1207242804_tok_chunk_0024,688278,特宝生物,1207242804,star_token_proxy_150_20260630,24,28,results/star_token_proxy_250_late50_20260702/chunks/688278_1207242804_tok_chunk_0024.txt,3941,8721,7881,275,276,"YPEG-G-CSF采用40kD Y型PEG修饰rhG-CSF，Ⅰ期临床半衰期平均约70小时。YPEG-G-CSFⅡ期临床显示20、30、45μg/kg剂量在总用药剂量降低一半以上时疗效与100μg/kg对照药相当。国内已上市长效重组人粒细胞刺激因子包括津优力、新瑞白、艾多。发行人称YPEG-G-CSF获批后将利用现有血液肿瘤线营销渠道，预计仍需研发投入约5,600万元。YPEG-EPO用于治疗慢性肾病贫血，2017年我国重组人促红素市场容量21.10亿元。YPEG-EPOⅠ期临床平均消除半衰期100.3-164.0小时，已获Ⅱ期临床试验通知书。",138,57,57,0,2,4,8,12,22,9,31,0.543859649122807,6,-25,3.3157894736842106,,28.557971014492754,108,79,27.404212128901293,20.045673686881504
688278_1207242804_tok_chunk_0025,688278,特宝生物,1207242804,star_token_proxy_150_20260630,25,28,results/star_token_proxy_250_late50_20260702/chunks/688278_1207242804_tok_chunk_0025.txt,3753,8336,7505,261,262,YPEG-GH用于儿童生长激素缺乏症，2017年国内重组人生长激素市场规模27.5亿元。YPEG-GH采用40kD Y型PEG修饰rhGH，Ⅰ期临床平均消除半衰期65-120小时。YPEG-GH正在开展治疗儿童生长激素缺乏症的Ⅱ/Ⅲ期临床研究，发行人预计可能于2022年获批上市。ACT50为PEG化靶向αvβ3的新型蛋白质药物，处于临床前研究阶段。ACT60为糖皮质激素及IL-2类激动剂联合药物组合，处于临床前研究阶段。YPEG-G-CSF、YPEG-EPO和YPEG-GH现有临床试验未发生可能导致临床终止的不良事件。,131,54,54,0,2,4,8,12,20,8,28,0.5185185185185185,6,-22,3.259259259259259,,28.64885496183206,95,52,25.3130828670397,13.85558220090594
688278_1207242804_tok_chunk_0026,688278,特宝生物,1207242804,star_token_proxy_150_20260630,26,28,results/star_token_proxy_250_late50_20260702/chunks/688278_1207242804_tok_chunk_0026.txt,3671,8387,7341,213,213,ACT50主要应用于肿瘤及新生血管生成相关疾病治疗，拟开发为抗血管生成剂类药物。ACT60主要应用于过敏性呼吸道疾病等过敏性疾病联合治疗。公司主要在研项目包括慢性乙肝临床治愈试验、YPEG-G-CSF、YPEG-EPO、YPEG-GH、ACT50、ACT60。发行人合作研发主要包括PEG-IL2联合DEX呼吸道吸入给药研究及ACT50药理早期研究。报告期委托外部研发费用主要用于临床研究、中心实验室检测、数据管理及统计分析。,107,48,48,0,3,5,8,10,15,7,22,0.4583333333333333,5,-17,3.0416666666666665,,34.308411214953274,133,81,36.22991010623809,22.06483247071643
688278_1207242804_tok_chunk_0027,688278,特宝生物,1207242804,star_token_proxy_150_20260630,27,28,results/star_token_proxy_250_late50_20260702/chunks/688278_1207242804_tok_chunk_0027.txt,3656,8378,7312,196,196,公司采用梯队式研发策略，先形成特尔立、特尔津、特尔康药物梯队，再形成聚乙二醇蛋白质长效药物梯队，并布局ACT50、ACT60等全新机制或创新结构重组蛋白质药物。截至2019年6月30日，公司有5名核心技术人员、127名研发人员，研发人员占员工总数17.37%。公司已自主开发申报14个品种，均取得临床批件，4个治疗用生物制品获批上市。团队承担9项国家重大新药创制专项，派格宾累计投入约3亿元。,98,34,34,0,3,4,8,10,7,2,9,0.2647058823529412,5,-6,2.588235294117647,,37.30612244897959,432,148,118.16192560175055,40.48140043763676
688278_1207242804_tok_chunk_0028,688278,特宝生物,1207242804,star_token_proxy_150_20260630,28,28,results/star_token_proxy_250_late50_20260702/chunks/688278_1207242804_tok_chunk_0028.txt,1435,3231,2870,46,46,公司与外协研发机构合作主要为满足药品注册管理要求，并对外协研发机构资质、进度和质量进行监督。,23,14,14,0,3,3,5,2,1,0,1,0.0714285714285714,1,0,1.6428571428571428,,62.391304347826086,156,63,108.71080139372823,43.90243902439024
688280_1211339290_tok_chunk_0001,688280,精进电动,1211339290,star_remaining_251_543_20260702,1,15,results/star_token_proxy_full_2019_2023_20260702/chunks/688280_1211339290_tok_chunk_0001.txt,3967,8869,7934,235,235,精进电动从事新能源汽车电驱动系统研发、生产、销售及服务，自主掌握驱动电机、控制器、传动三大总成核心技术。公司已在北京、上海、正定、菏泽、余姚及美国底特律设立研发和生产基地。2020年碳化硅控制器获斯堪尼亚、曼恩量产配套项目；2019年获菲亚特克莱斯勒北美杰出质量奖。公司驱动电机国内市占率2017至2020年分别列全行业第四、第四、第三、第十。截至招股说明书签署日，公司拥有软件著作权18项、境内授权发明专利27项、实用新型210项、外观设计97项、境外授权专利43项。,118,138,138,0,14,28,54,27,12,3,15,0.108695652173913,5,-10,2.028985507246377,,33.61864406779661,227,129,57.22208217796824,32.51827577514495
688280_1211339290_tok_chunk_0002,688280,精进电动,1211339290,star_remaining_251_543_20260702,2,15,results/star_token_proxy_full_2019_2023_20260702/chunks/688280_1211339290_tok_chunk_0002.txt,3870,8647,7740,37,37,公司主营业务属于新能源汽车关键零部件，所处行业为新能源汽车装置、配件制造。,19,77,77,0,5,65,5,2,0,0,0,0.0,1,1,1.051948051948052,,203.68421052631578,70,22,18.08785529715762,5.684754521963824
688280_1211339290_tok_chunk_0003,688280,精进电动,1211339290,star_remaining_251_543_20260702,3,15,results/star_token_proxy_full_2019_2023_20260702/chunks/688280_1211339290_tok_chunk_0003.txt,3983,8930,7965,45,45,国家新能源汽车政策对公司经营发展具有正向促进作用，但补贴门槛提高和补贴收紧将加剧行业竞争。,23,93,93,0,7,80,6,0,0,0,0,0.0,1,1,0.989247311827957,,173.17391304347825,99,59,24.855636454933467,14.812955059000753
688280_1211339290_tok_chunk_0004,688280,精进电动,1211339290,star_remaining_251_543_20260702,4,15,results/star_token_proxy_full_2019_2023_20260702/chunks/688280_1211339290_tok_chunk_0004.txt,3945,9383,7890,45,45,中国2015至2019年持续为全球最大新能源汽车销售市场，2020年市场规模位居全球第二。,23,86,86,0,10,64,9,3,0,0,0,0.0,1,1,1.058139534883721,,171.52173913043478,60,42,15.209125475285171,10.64638783269962
688280_1211339290_tok_chunk_0005,688280,精进电动,1211339290,star_remaining_251_543_20260702,5,15,results/star_token_proxy_full_2019_2023_20260702/chunks/688280_1211339290_tok_chunk_0005.txt,3942,9217,7884,53,53,精进电动2015年推出电磁齿嵌式离合器，2016年推出减速器和控制器，2019年1月推出三合一电驱动系统。,27,74,74,0,6,60,6,2,0,0,0,0.0,1,1,1.054054054054054,,146.0,65,35,16.489091831557584,8.878741755454083
688280_1211339290_tok_chunk_0006,688280,精进电动,1211339290,star_remaining_251_543_20260702,6,15,results/star_token_proxy_full_2019_2023_20260702/chunks/688280_1211339290_tok_chunk_0006.txt,3980,9160,7959,90,90,发行人处于碳化硅半导体产业链应用环节，通过硬件设计、软件开发、工艺优化和测试验证生产碳化硅控制器。精进电动碳化硅控制器配套Traton下属斯堪尼亚和曼恩，预计2024年初量产上市。,45,53,53,0,4,35,8,4,2,0,2,0.0377358490566037,2,0,1.339622641509434,,88.44444444444444,104,53,26.13065326633166,13.316582914572864
688280_1211339290_tok_chunk_0007,688280,精进电动,1211339290,star_remaining_251_543_20260702,7,15,results/star_token_proxy_full_2019_2023_20260702/chunks/688280_1211339290_tok_chunk_0007.txt,3990,9034,7979,26,26,新能源汽车补贴退坡推动产业由政策驱动向市场驱动转变。,13,58,58,0,5,46,5,2,0,0,0,0.0,1,1,1.0689655172413792,,306.9230769230769,73,46,18.295739348370926,11.528822055137844
688280_1211339290_tok_chunk_0008,688280,精进电动,1211339290,star_remaining_251_543_20260702,8,15,results/star_token_proxy_full_2019_2023_20260702/chunks/688280_1211339290_tok_chunk_0008.txt,3979,8959,7957,312,313,"精进电动报告期内基本未配套A00级和A0级车型，主要配套吉利帝豪EV、小鹏P7、Jeep指挥官PHEV、克莱斯勒Pacifica PHEV等A至D级车型。剔除A00和A0级后，公司2017至2019年国内市占率分别为8.39%、10.07%、11.10%。2020年公司驱动电机国内销量48,814台套，全行业第10，国内独立供应商第4。公司2020年向菲亚特克莱斯勒出口油冷驱动电机30,766台套，未纳入国内排名。公司驱动电机、控制器、传动总成峰值效率约97%、98.5%、98%，高效区间占比均超过90%。公司三合一产品总体声压77.54dB(A)，低于两套国际竞争对手产品的92.80dB(A)、88.96dB(A)。",156,93,93,0,7,33,24,14,11,4,15,0.1612903225806451,6,-9,2.010752688172043,,25.506410256410255,111,65,27.896456396079415,16.33576275446092
688280_1211339290_tok_chunk_0009,688280,精进电动,1211339290,star_remaining_251_543_20260702,9,15,results/star_token_proxy_full_2019_2023_20260702/chunks/688280_1211339290_tok_chunk_0009.txt,3953,9014,7905,280,280,"公司参与合作研发项目中12项列入国家重点研发计划。公司累计投入过亿元建设仿真实验环境，拥有核心实验装备约70余套，具备ISO、IEC、SAE、DIN、JIS等国际标准实验能力。公司研发实验中心拥有国家地方联合工程实验室、北京市企业技术中心等资质。2019年公司获菲亚特克莱斯勒北美杰出质量奖，2016至2019年连续四届获铃轩奖。2018至2020年公司核心技术产品收入占比分别为99.62%、98.80%、98.75%。2020年乘用车电驱动系统收入23,458.05万元、销量66,296套，商用车电驱动系统收入20,436.58万元、销量14,496套。",140,79,79,0,6,10,28,18,13,4,17,0.2151898734177215,6,-11,2.430379746835443,,28.235714285714284,102,51,25.80318745256767,12.901593726283835
688280_1211339290_tok_chunk_0010,688280,精进电动,1211339290,star_remaining_251_543_20260702,10,15,results/star_token_proxy_full_2019_2023_20260702/chunks/688280_1211339290_tok_chunk_0010.txt,3986,9296,7972,215,216,"2020年公司采购总额64,709.84万元，其中原材料采购32,988.01万元，占50.98%。主要原材料包括磁钢、硅钢片、壳体、漆包线、控制器、端盖、IGBT、轴等。2020年前五大供应商采购额合计14,025.65万元，占21.67%。截至2020年12月31日，公司固定资产账面价值44,691.61万元，其中机器设备32,777.50万元。公司拥有美国Farmington Hills约8,062平方米生产研发办公房产。",108,73,73,0,5,7,31,17,11,2,13,0.1780821917808219,5,-8,2.3835616438356166,,36.907407407407405,106,70,26.593075765178124,17.561465127947816
688280_1211339290_tok_chunk_0011,688280,精进电动,1211339290,star_remaining_251_543_20260702,11,15,results/star_token_proxy_full_2019_2023_20260702/chunks/688280_1211339290_tok_chunk_0011.txt,3871,10325,7742,108,108,"发行人主要科研、生产、办公租赁合同多为长期租赁，并拥有优先续租权或买断权。2020年12月31日，公司无形资产账面价值1,440.03万元，其中软件1,176.45万元。公司拥有境内注册商标18项、境外注册商标6项。",54,47,47,0,4,13,19,8,3,0,3,0.0638297872340425,3,0,1.851063829787234,,71.68518518518519,125,93,32.29139757168691,24.024799793335056
688280_1211339290_tok_chunk_0012,688280,精进电动,1211339290,star_remaining_251_543_20260702,12,15,results/star_token_proxy_full_2019_2023_20260702/chunks/688280_1211339290_tok_chunk_0012.txt,3981,10785,7961,78,78,公司境内专利覆盖电机冷却、自动变速器、电磁齿嵌式离合器、三合一电驱动总成、油冷电机等技术。公司多项发明专利由发行人或子公司自主持有，部分与清华大学共同持有。,39,269,269,0,8,0,249,10,2,0,2,0.0074349442379182,2,0,1.9925650557620815,,102.07692307692308,45,45,11.303692539562924,11.303692539562924
688280_1211339290_tok_chunk_0013,688280,精进电动,1211339290,star_remaining_251_543_20260702,13,15,results/star_token_proxy_full_2019_2023_20260702/chunks/688280_1211339290_tok_chunk_0013.txt,3921,10717,7841,196,196,发行人及精进正定、精进百思特拥有新能源汽车电机、电驱动总成、逆变器、电子驻车、差速锁、冷却结构和装配工装等专利。表列境内专利序号202至334，涵盖实用新型和外观设计，申请时间主要为2016年至2021年。专利产品包括直驱电机、双电机驱动系统、OD154/OD180/OD220电驱动总成、Gamma动力总成、油冷定转子及控制器等。境外另有美国发明专利2项，涉及匝数测试装置及电机油冷却方法。,98,132,132,0,5,0,118,7,2,0,2,0.0151515151515151,4,0,2.007575757575758,,40.01020408163265,43,41,10.966590155572558,10.456516194848254
688280_1211339290_tok_chunk_0014,688280,精进电动,1211339290,star_remaining_251_543_20260702,14,15,results/star_token_proxy_full_2019_2023_20260702/chunks/688280_1211339290_tok_chunk_0014.txt,3983,10359,7966,189,189,公司拥有境外授权专利43项，覆盖美国、欧盟、日本、香港。公司拥有软件著作权18项，涉及永磁同步电机控制、电池管理、生产设备管理、整车控制器等软件。发行人核心技术覆盖驱动电机、控制器、传动总成三大领域，多项技术达到国内领先或国际先进。高效电机技术可提升最高效率1%-3%、减重大于10%。电机集成化技术可实现总成重量减轻10%以上。电磁离合器执行机构在动力传递中效率接近100%。,95,96,96,0,5,2,60,16,11,2,13,0.1354166666666666,6,-7,2.3333333333333335,,41.92631578947368,303,137,76.07331157419031,34.396183781069546
688280_1211339290_tok_chunk_0015,688280,精进电动,1211339290,star_remaining_251_543_20260702,15,15,results/star_token_proxy_full_2019_2023_20260702/chunks/688280_1211339290_tok_chunk_0015.txt,2342,5460,4683,278,278,"公司合作研发项目主要为国家科技支撑计划和国家重点研发计划，覆盖SiC电机控制器、油冷电机、一体化纯电驱动系统、高效增程器等方向。公司在研非合作项目包括三合一系统、新型油冷电机、小型电机多合一系统、国际客户纯电动三合一等。2020年公司研发投入12,786.54万元，占营业收入22.11%。截至2020年12月31日，公司拥有研发技术人员451名，占员工总数54.87%。公司核心技术人员主导电驱动系统产品规划、控制器、传动总成和驱动电机升级。发行人在油冷驱动电机、第三代碳化硅半导体控制器、方导体驱动电机、多合一电驱动系统、多档减速器等领域进行技术储备。",139,82,82,0,5,5,28,20,18,6,24,0.2926829268292683,6,-18,2.7195121951219514,,16.848920863309353,215,96,91.80187873612297,40.990606319385144
688281_1212482414_tok_chunk_0001,688281,华秦科技,1212482414,star_late2022_batch006_20260702,1,11,results/star_token_proxy_250_late50_20260702/chunks/688281_1212482414_tok_chunk_0001.txt,3965,8469,7929,216,216,"公司主营特种功能材料，产品用于飞机、坦克、舰船、导弹等装备隐身、军事目标伪装和装备防护。隐身材料、伪装材料核心产品分别于2019年、2020年批产，并在多军种、多型号装备装机应用。公司建有陕西省隐身材料技术工程研究中心、院士专家工作站、博士后科研工作站。2021年1-6月特种功能材料产品收入19,100.70万元，占营业收入96.98%。报告期特种功能材料产品收入占比分别为82.94%、91.11%、86.75%、96.98%。",108,94,94,0,10,17,35,24,6,2,8,0.0851063829787234,5,-3,2.0531914893617023,,36.71296296296296,222,115,55.989911727616644,29.003783102143757
688281_1212482414_tok_chunk_0002,688281,华秦科技,1212482414,star_late2022_batch006_20260702,2,11,results/star_token_proxy_250_late50_20260702/chunks/688281_1212482414_tok_chunk_0002.txt,4000,8747,7999,220,220,公司获批院士专家工作站、博士后科研工作站、陕西省博士后创新基地和陕西省隐身材料技术工程研究中心。公司1996年起联合西北工业大学开展特种功能材料预研，2021年7月停止原航空零部件加工业务。2016年5月公司受让西工大22项专利权和10项专利申请权。隐身材料及伪装材料核心型号分别于2019年、2020年批产应用。截至招股说明书签署日，公司获授权40项发明专利，另有44项在申请国防发明专利。报告期末公司研发人员48名，占员工20.78%。,110,102,102,0,14,20,36,23,7,2,9,0.088235294117647,6,-3,1.9509803921568627,,36.36363636363637,378,170,94.5,42.5
688281_1212482414_tok_chunk_0003,688281,华秦科技,1212482414,star_late2022_batch006_20260702,3,11,results/star_token_proxy_250_late50_20260702/chunks/688281_1212482414_tok_chunk_0003.txt,3993,9133,7985,138,138,"公司污染物检测最高值均达标，废水处理能力15立方米/天，有机废气和粉尘处理能力分别为45,000、54,000立方米/小时。2021年1-6月环保设备投入93.36万元，环保费用4.18万元。2018年1月1日至2021年9月14日，环保主管部门未发现公司环境违法或污染事故。",69,70,70,0,9,35,16,7,3,0,3,0.0428571428571428,3,0,1.4285714285714286,,57.869565217391305,125,59,31.30478337089907,14.775857751064363
688281_1212482414_tok_chunk_0004,688281,华秦科技,1212482414,star_late2022_batch006_20260702,4,11,results/star_token_proxy_250_late50_20260702/chunks/688281_1212482414_tok_chunk_0004.txt,3851,8082,7701,57,57,公司产品包括隐身材料、伪装材料及防护材料，主要用于国防科技工业。隐身材料具有研发周期长、定制化和供应商稳定性特征。,29,62,62,0,4,44,9,5,0,0,0,0.0,2,2,1.2419354838709675,,132.79310344827587,162,65,42.06699558556219,16.878732796676186
688281_1212482414_tok_chunk_0005,688281,华秦科技,1212482414,star_late2022_batch006_20260702,5,11,results/star_token_proxy_250_late50_20260702/chunks/688281_1212482414_tok_chunk_0005.txt,3995,8457,7990,149,149,公司隐身材料及伪装材料核心产品分别于2019年、2020年批产，形成自主可控核心技术。公司批产应用产品包括3个牌号耐温隐身材料和2个牌号伪装材料。公司隐身、伪装材料拥有38项授权国防发明专利、33项在申请国防发明专利。2016年公司隐身材料技术成果经鉴定达到国际先进水平，部分方面达到国际领先水平。,75,86,86,0,5,58,12,6,4,1,5,0.0581395348837209,4,-1,1.4069767441860466,,53.266666666666666,205,77,51.314142678347935,19.274092615769714
688281_1212482414_tok_chunk_0006,688281,华秦科技,1212482414,star_late2022_batch006_20260702,6,11,results/star_token_proxy_250_late50_20260702/chunks/688281_1212482414_tok_chunk_0006.txt,3554,7545,7107,314,314,"公司新型伪装材料可实现地面军事目标多频谱兼容高仿真伪装，截至招股说明书签署日获授权国防发明专利38项、国家发明专利2项。公司隐身材料和伪装材料核心产品分别于2019年、2020年批产，并在多军种、多型号装备装机应用。报告期批产定型产品收入占主营业务收入0.00%、36.90%、88.47%、93.18%。公司研发费用分别为557.82万元、1,764.47万元、4,270.98万元、2,788.50万元，占营业收入11.73%、15.11%、10.32%、14.16%。主要客户A1单位对公司质量、交付、服务评价均在99.5分以上。报告期主营业务军品收入占比分别为100.00%、100.00%、99.93%、99.83%。",157,74,74,0,3,12,23,22,10,4,14,0.1891891891891892,6,-8,2.4864864864864864,,22.636942675159236,225,89,63.30894766460327,25.042205965109737
688281_1212482414_tok_chunk_0007,688281,华秦科技,1212482414,star_late2022_batch006_20260702,7,11,results/star_token_proxy_250_late50_20260702/chunks/688281_1212482414_tok_chunk_0007.txt,3924,9117,7847,267,267,"报告期公司营业收入分别为4,756.09万元、11,676.66万元、41,386.47万元、19,694.61万元。公司净利率分别为21.55%、-90.42%、37.41%、45.11%，2019年扣非净利率为28.62%。2020年末公司研发人员38人，占比19.69%。报告期研发投入占营业收入比例为11.73%、15.11%、10.32%、14.16%。2021年1-6月隐身材料收入18,165.14万元，占主营业务收入95.10%。报告期军品收入占主营业务收入100.00%、100.00%、99.93%、99.83%。",134,58,58,0,2,4,14,19,13,6,19,0.3275862068965517,6,-13,2.9482758620689653,,29.28358208955224,97,21,24.71967380224261,5.351681957186544
688281_1212482414_tok_chunk_0008,688281,华秦科技,1212482414,star_late2022_batch006_20260702,8,11,results/star_token_proxy_250_late50_20260702/chunks/688281_1212482414_tok_chunk_0008.txt,3952,9113,7903,257,257,"2021年1-6月公司前五大客户收入19,081.20万元，占主营业务收入99.90%。报告期前五大客户收入占比分别为100.00%、100.00%、99.25%、99.90%。报告期对A集团收入占比分别为99.42%、98.71%、87.94%、95.00%。报告期对A1单位收入占比分别为75.72%、80.30%、66.70%、65.98%。2021年1-6月靶材采购7,673.95万元，占主营业务采购额81.25%。报告期前五大供应商采购占比分别为99.16%、95.98%、96.63%、93.98%。",129,89,89,0,4,11,25,29,14,6,20,0.2247191011235955,6,-14,2.6292134831460676,,30.635658914728683,167,84,42.25708502024292,21.25506072874494
688281_1212482414_tok_chunk_0009,688281,华秦科技,1212482414,star_late2022_batch006_20260702,9,11,results/star_token_proxy_250_late50_20260702/chunks/688281_1212482414_tok_chunk_0009.txt,3858,8455,7715,258,258,"截至2021年6月30日，公司定制非标准设备账面原值2,250.42万元，占机器设备原值71.82%。截至招股说明书签署日，公司拥有2宗出让土地使用权、48项注册商标、38项国防发明专利和2项国家发明专利。2016年5月公司以150万元受让西工大22项专利权和10项专利申请权。公司已取得职业健康安全、环境管理、高新技术企业、危化品经营等资质及军品生产销售所需资质。公司9项核心技术覆盖隐身材料、伪装材料和防护材料，其中3项隐身材料技术已批产。公司核心技术对应产品拥有3个牌号耐温隐身材料、2个牌号伪装材料定型批产。",129,92,92,0,3,7,23,36,17,6,23,0.25,6,-17,2.8152173913043477,,29.906976744186046,440,198,114.04872991187145,51.32192846034215
688281_1212482414_tok_chunk_0010,688281,华秦科技,1212482414,star_late2022_batch006_20260702,10,11,results/star_token_proxy_250_late50_20260702/chunks/688281_1212482414_tok_chunk_0010.txt,3979,9142,7957,226,226,"公司主营业务收入100%来自核心技术。公司获授权发明专利40项，并建立核心技术保密和研发制度。公司获得2017年国防技术发明一等奖、2018年国家技术发明二等奖。公司建有陕西省隐身材料技术工程研究中心、院士专家工作站和博士后科研工作站。截至2021年6月30日，公司研发人员48人，占员工20.78%，其中硕士及以上33人，占研发人员68.75%。报告期研发费用分别为557.82万元、1,764.47万元、4,270.98万元、2,788.50万元。",113,85,85,0,2,6,19,31,20,7,27,0.3176470588235294,6,-21,2.9647058823529413,,35.21238938053097,468,209,117.61749183211863,52.52576024126665
688281_1212482414_tok_chunk_0011,688281,华秦科技,1212482414,star_late2022_batch006_20260702,11,11,results/star_token_proxy_250_late50_20260702/chunks/688281_1212482414_tok_chunk_0011.txt,1456,3420,2911,168,168,"华秦科技研发流程包括研发规划、方案设计、新产品试制和设计定型，市场、技术、科研项目、生产、质管等部门分工参与。报告期公司合作承担Q、D、O、N、Z等国家科研项目，其中Q项目由公司牵头，预计投入1,793万元；D项目由公司牵头，投入10人、预计投入2,370万元；O、N项目亦由公司牵头，Z项目中公司配合西北工业大学开展涂层修复工艺探索。",84,46,46,0,4,8,19,11,4,0,4,0.0869565217391304,4,-1,2.0652173913043477,,17.333333333333332,173,78,118.81868131868131,53.57142857142857
