custom_id,sec_code,sec_name,announcement_id,source_run_name,chunk_index,chunk_count,chunk_file,chunk_token_proxy,chunk_chars,chunk_compact_chars,summary_compact_chars,summary_chars,summary_text,summary_token_proxy,sentence_count,sentence_count_reported,sentence_count_mismatch,n0,n1,n2,n3,n4,n5,high_score_count,high_score_share,summary_sentence_count,summary_high_score_gap,relevant_score,relevant_score_model,Redundancy_chunk,innovation_terms_all_union,innovation_terms_without_target,innovation_rate_all_union,innovation_rate_without_target
688121_1210943561_tok_chunk_0011,688121,卓然股份,1210943561,star_remaining_251_543_20260702,11,12,results/star_token_proxy_full_2019_2023_20260702/chunks/688121_1210943561_tok_chunk_0011.txt,3905,8946,7809,297,297,公司整体模块化供货技术应用于浙石化4000万吨/年炼化一体化项目一期、二期，拥有1项授权发明专利、2项受理发明专利和26项实用新型专利。公司耐热钢炉管智能化生产技术形成炉管制备全线优化，拥有1项授权发明专利、3项受理发明专利和10项实用新型专利。公司“离心铸造高温炉管质量评价与控制关键技术”获中国机械工业集团科学技术奖。公司“大型抗结焦乙烯裂解炉”获国家重点新产品证书。公司“乙烯裂解炉及其生产区智能信息系统建设”获上海市2017年工业互联网创新发展专项支持。截至2020年12月31日，公司在研项目包括大型乙烯裂解整体炉制造、催化裂解制乙烯丙烯技术开发、乙烯裂解炉及其生产区智能信息系统等。,149,72,72,0,4,10,20,14,18,6,24,0.3333333333333333,6,-18,2.6944444444444446,,26.20805369127517,273,122,69.91037131882203,31.241997439180537
688121_1210943561_tok_chunk_0012,688121,卓然股份,1210943561,star_remaining_251_543_20260702,12,12,results/star_token_proxy_full_2019_2023_20260702/chunks/688121_1210943561_tok_chunk_0012.txt,2947,6690,5893,212,212,2020年公司研发投入1.32亿元，占营业收入4.82%。报告期内公司研发人员由35人增至86人，2020年研发人员占员工总数12.43%。公司核心技术人员4人，报告期内未发生变动。公司与北京化工大学合作开发乙烯裂解装置智能监控界面及接口系统，知识产权约定双方共享。公司与中国石油大学（华东）合作轻烃催化裂解制乙烯丙烯研究，知识产权归公司。公司与路易斯安那州立大学合作乙烯裂解装置智能监控系统开发，涉及资助发明和专利权安排。,106,68,68,0,5,9,18,18,14,4,18,0.2647058823529412,6,-12,2.573529411764706,,27.80188679245283,282,136,95.69053274516457,46.14862572107228
688135_1208691414_tok_chunk_0001,688135,利扬芯片,1208691414,star_batch004_20260701,1,11,results/star_token_proxy_250_late50_20260702/chunks/688135_1208691414_tok_chunk_0001.txt,3950,8878,7899,277,277,"公司主营集成电路测试方案开发、12英寸及8英寸晶圆测试、芯片成品测试及配套服务。公司累计研发33大类测试解决方案，完成超过3,000种芯片型号量产测试，工艺涵盖8nm、16nm、28nm。公司拥有95项已授权专利，其中8项为发明专利，并获国家级高新技术企业等认定。2020年1-6月、2019年、2018年、2017年主营业务收入分别为12,108.07万元、22,552.64万元、13,348.09万元、12,515.28万元。先进工艺AI计算芯片测试方案实现最终平均良率99.00%，部分5G、传感器、北斗方案达到明确噪声、增益、灵敏度等测试指标。",139,118,118,0,18,31,25,29,12,3,15,0.1271186440677966,5,-10,1.9576271186440677,,28.41726618705036,296,218,74.9367088607595,55.189873417721515
688135_1208691414_tok_chunk_0002,688135,利扬芯片,1208691414,star_batch004_20260701,2,11,results/star_token_proxy_250_late50_20260702/chunks/688135_1208691414_tok_chunk_0002.txt,3819,8081,7637,236,236,公司采购主要包括进口测试设备和测试辅料，并取得ISO9001:2015、IATF16949:2016、ANSI/ESD-S20.20-2104、ISO14001:2015等认证。公司采用以销定产模式，按客户订单设计个性化测试方案并量产测试。2017年至2019年，芯片成品高端测试平台毛利率为53.93%、55.61%、77.32%，2019年上升主要来自8nm先进制程测试项目。2020年1-6月晶圆高端测试平台毛利率为42.38%，较2019年上涨18.63个百分点。,118,96,96,0,11,45,23,10,7,0,7,0.0729166666666666,4,-3,1.5520833333333333,,32.36440677966102,330,271,86.41005498821681,70.96098455092955
688135_1208691414_tok_chunk_0003,688135,利扬芯片,1208691414,star_batch004_20260701,3,11,results/star_token_proxy_250_late50_20260702/chunks/688135_1208691414_tok_chunk_0003.txt,3976,8782,7951,100,100,2017年至2020年1-6月，发行人环保投入分别为26.48万元、27.81万元、28.00万元和17.41万元。发行人主营业务归属C3973集成电路制造，并属于战略性新兴产业分类中的集成电路制造。,50,86,86,0,10,57,12,5,2,0,2,0.0232558139534883,2,0,1.2093023255813953,,79.52,190,133,47.78672032193159,33.45070422535211
688135_1208691414_tok_chunk_0004,688135,利扬芯片,1208691414,star_batch004_20260701,4,11,results/star_token_proxy_250_late50_20260702/chunks/688135_1208691414_tok_chunk_0004.txt,4000,8786,8000,286,286,"发行人2019年营业收入2.32亿元，高于华岭股份2019年1.46亿元。发行人2019年晶圆测试44.62万片、芯片成品测试11.31亿颗，营业收入23,201.34万元。京元电子2019年晶圆测试400.10万片、芯片成品测试75.18亿颗，营业收入594,558.09万元。发行人测试先进制程芯片主要为区块链算力芯片，是比特微、上海磐矽等客户主要测试供应商。公司累计研发33大类测试解决方案，完成超过3,000种芯片型号量产测试，取得95项专利。报告期主营业务收入分别为12,515.28万元、13,348.09万元、22,552.64万元和12,108.07万元。",143,92,92,0,7,40,18,14,10,3,13,0.1413043478260869,6,-7,1.8804347826086956,,27.972027972027973,330,256,82.5,64.0
688135_1208691414_tok_chunk_0005,688135,利扬芯片,1208691414,star_batch004_20260701,5,11,results/star_token_proxy_250_late50_20260702/chunks/688135_1208691414_tok_chunk_0005.txt,3985,8482,7969,261,261,发行人拥有爱德万93K、T2K、T5、EVA100，泰瑞达J750、Magnum等测试设备，覆盖存储器、逻辑和混合信号、无线射频、系统级、生物和MEMS芯片测试。公司在广东东莞和上海嘉定建立两大生产基地，贴近华南终端客户与华东晶圆、封装环节。公司研发团队可开发多种高端测试平台方案，并形成生物识别、5G通讯、先进制程AI计算、智能传感器、北斗导航等测试方案。公司自主研发条状封装产品自动探针台、3D高频智能分类机械手，并已用于生产实践。部分汽车电子芯片要求三温极限测试能力，高温+85℃/175℃、低温-65℃/-45℃。,131,105,105,0,8,43,20,23,9,2,11,0.1047619047619047,5,-6,1.8857142857142857,,30.419847328244273,284,193,71.267252195734,48.431618569636136
688135_1208691414_tok_chunk_0006,688135,利扬芯片,1208691414,star_batch004_20260701,6,11,results/star_token_proxy_250_late50_20260702/chunks/688135_1208691414_tok_chunk_0006.txt,3991,8869,7982,378,378,"2019年发行人总资产58,000.82万元、营业收入23,201.34万元、净利润6,083.79万元。发行人晶圆测试支持5、6、8、12英寸，温度范围-55℃至150℃，最高4000pin，最大512site，最小Pad间距45μm。发行人芯片成品测试封装尺寸1x1mm至70x70mm，测试温度-55℃至150℃，测试频率至26GHz，最大256site。2020年1-6月晶圆测试产能利用率88.20%，2019年、2018年、2017年分别为90.48%、96.07%、83.48%。2020年1-6月芯片成品测试产能利用率44.19%，2019年、2018年、2017年分别为62.53%、56.11%、73.19%。报告期末芯片成品测试平台分别为192套、215套、266套和284套，晶圆测试平台分别为82套、121套、137套和144套。",189,78,78,0,6,23,19,15,12,3,15,0.1923076923076923,6,-9,2.1666666666666665,,21.116402116402117,248,197,62.139814582811326,49.36106239037835
688135_1208691414_tok_chunk_0007,688135,利扬芯片,1208691414,star_batch004_20260701,7,11,results/star_token_proxy_250_late50_20260702/chunks/688135_1208691414_tok_chunk_0007.txt,3957,9281,7913,373,373,"公司与汇顶科技、全志科技、国民技术、东软载波、锐能微、比特微等芯片设计企业建立长期合作。报告期前五名客户收入合计分别为11,329.65万元、10,660.42万元、17,723.51万元和9,206.44万元，占营业收入87.61%、77.04%、76.39%和74.01%。2020年1-6月前五名客户中，比特微销售2,681.20万元，占21.55%；汇顶科技2,513.25万元，占20.20%。2019年前五名客户中，比特微销售6,670.02万元，占28.75%；汇顶科技6,360.99万元，占27.42%。截至2020年6月30日，公司固定资产账面价值36,989.20万元，生产设备原值48,628.76万元。主要生产设备包括测试机362台、分选机284台、探针台144台、产品外观检测机14台，合计原值47,795.69万元。",187,91,91,0,5,13,19,16,30,8,38,0.4175824175824176,6,-32,2.8461538461538463,,21.16042780748663,144,78,36.391205458680815,19.711902956785444
688135_1208691414_tok_chunk_0008,688135,利扬芯片,1208691414,star_batch004_20260701,8,11,results/star_token_proxy_250_late50_20260702/chunks/688135_1208691414_tok_chunk_0008.txt,3720,9524,7440,236,236,东莞项目计划2021年6月开工、2023年6月竣工、2023年12月投产。上海嘉定项目拟供地约40亩，计划2022年4月开工、2024年4月竣工、2024年10月投产。发行人及子公司已取得95项专利，其中87项实用新型专利、8项发明专利。公司拥有8项软件著作权，涵盖Chroma3360程序开发、不同频率集成电路功能测试、生产管理、V93000芯片功能测试等软件。2019年12月，公司取得高新技术企业证书，有效期3年。公司商标共9项，类别覆盖第9类、第35类、第42类。,118,73,73,0,6,8,15,14,24,6,30,0.410958904109589,6,-24,2.8219178082191783,,31.52542372881356,152,138,40.86021505376344,37.096774193548384
688135_1208691414_tok_chunk_0009,688135,利扬芯片,1208691414,star_batch004_20260701,9,11,results/star_token_proxy_250_late50_20260702/chunks/688135_1208691414_tok_chunk_0009.txt,3997,9016,7993,317,317,公司取得ISO9001:2015、IATF16949:2016、ISO14001:2015、ANSI/ESD-S20.20-2014等资质。客户授予公司区块链运算芯片测试技术创新奖、最佳5G射频LAN芯片测试解决方案奖、北斗射频芯片测试技术创新奖等荣誉。发行人核心技术覆盖触控、指纹、无线工控、区块链算力、心率传感器、存储、光通讯、SIM卡、北斗和金融安全芯片测试。公司区块链算力芯片测试技术解决低压大电流供电和芯片结温稳定问题，可用于区块链、AI等先进工艺芯片测试。公司存储芯片多工位同测技术将同测数扩展至512颗，并将系统水平误差控制在15μm以内。公司金融安全芯片识别码分发系统实现数十套测试系统并行测试，识别码准确率100%。,159,114,114,0,4,17,28,34,24,7,31,0.2719298245614035,6,-25,2.6842105263157894,,25.138364779874212,421,288,105.32899674756068,72.0540405303978
688135_1208691414_tok_chunk_0010,688135,利扬芯片,1208691414,star_batch004_20260701,10,11,results/star_token_proxy_250_late50_20260702/chunks/688135_1208691414_tok_chunk_0010.txt,3980,9046,7960,364,364,"公司连接治具设计可实现分选机与测试机50μm级匹配、探针台与测试机10μm级匹配。公司核心技术服务收入2017年至2020年1-6月分别为11,601.53万元、12,224.61万元、20,591.42万元和10,817.75万元，占营业收入89.71%、88.34%、88.75%和86.96%。截至招股说明书签署日，公司及子公司取得95项专利、8项软件著作权。公司在研5G射频开关芯片方案目标实现隔离度低于-60dB、测试时间小于5s。公司在研大规模FPGA测试方案覆盖高温4颗同测、Burn-in、高温单颗和常温4颗同测流程。公司研发费用2017年至2020年1-6月分别为1,097.62万元、1,256.03万元、2,199.13万元和1,131.79万元，占营业收入8.49%、9.08%、9.48%和9.10%。",182,112,112,0,5,16,22,32,30,7,37,0.3303571428571428,6,-31,2.7767857142857144,,21.86813186813187,562,312,141.20603015075378,78.39195979899498
688135_1208691414_tok_chunk_0011,688135,利扬芯片,1208691414,star_batch004_20260701,11,11,results/star_token_proxy_250_late50_20260702/chunks/688135_1208691414_tok_chunk_0011.txt,241,525,482,153,153,"发行人拥有形成主营业务收入的已授权发明专利8项。最近三年营业收入分别为12,932.00万元、13,838.14万元和23,201.34万元，复合增长率33.94%。报告期境外收入分别为3.23万元、31.13万元、18.09万元和65.79万元，占收入比重0.02%、0.22%、0.08%和0.53%。",77,23,23,0,3,4,4,3,7,2,9,0.391304347826087,3,-6,2.5652173913043477,,3.1298701298701297,6,4,24.896265560165972,16.597510373443985
688139_1206999086_tok_chunk_0001,688139,海尔生物,1206999086,star_token_proxy_150_20260630,1,10,results/star_token_proxy_250_late50_20260702/chunks/688139_1206999086_tok_chunk_0001.txt,3986,8954,7972,199,200,"发行人主营生物医疗低温存储设备，产品覆盖-196℃至8℃，主要收入来自设备销售。发行人打破国外垄断，获行业内唯一国家科技进步奖，国产品牌市场份额首位。发行人及核心研发人员牵头或参与9项国家、行业标准，并参与WHO国际标准。2018年主营业务收入82,628.04万元，生物样本库收入占48.04%。太阳能疫苗存储18个型号通过WHO PQS认证，太阳能系列断电后43℃环境下可保持8℃以下120小时。",100,86,86,0,8,2,42,20,11,3,14,0.1627906976744186,5,-9,2.383720930232558,,39.86,94,46,23.582538886101357,11.54039136979428
688139_1206999086_tok_chunk_0002,688139,海尔生物,1206999086,star_token_proxy_150_20260630,2,10,results/star_token_proxy_250_late50_20260702/chunks/688139_1206999086_tok_chunk_0002.txt,3980,9018,7959,253,253,发行人产品按生物样本库、药品试剂、疫苗、血液等场景区分，核心差异包括存储温度、制冷技术和产品结构。HXC血液产品存储温度为4℃±1℃，温度均匀性和稳定性要求高于HYC系列。公司2016至2019年1-3月经销收入占主营业务收入比例分别为94.50%、82.50%、76.07%和85.00%。报告期末签约经销商为114家、112家、109家和134家，对境内经销收入占比分别为83.02%、92.80%、92.24%和95.04%。2018年无资质经销商销售收入156.95万元，占主营业务收入0.19%。,127,93,93,0,4,3,52,23,9,2,11,0.1182795698924731,5,-6,2.3870967741935485,,31.338582677165356,65,37,16.331658291457288,9.296482412060302
688139_1206999086_tok_chunk_0003,688139,海尔生物,1206999086,star_token_proxy_150_20260630,3,10,results/star_token_proxy_250_late50_20260702/chunks/688139_1206999086_tok_chunk_0003.txt,3825,8558,7650,116,116,发行人通过海外经销商覆盖亚太、欧洲、中东及南亚、南美、北美、印度六个地区。公司2017年7月成立国内直销团队，服务上海及周边生物医药研发制造客户。发行人为Nuaire提供ODM低温产品，结合自身低温技术与Nuaire渠道、品牌优势。,58,72,72,0,9,43,12,5,3,0,3,0.0416666666666666,3,0,1.3055555555555556,,65.94827586206897,110,54,28.75816993464052,14.11764705882353
688139_1206999086_tok_chunk_0004,688139,海尔生物,1206999086,star_token_proxy_150_20260630,4,10,results/star_token_proxy_250_late50_20260702/chunks/688139_1206999086_tok_chunk_0004.txt,3904,8382,7807,157,157,以发行人为代表的国内企业实现低温存储产品技术突破及产业化，产品覆盖-196℃至8℃。2018年全球生物医疗低温存储市场规模27.47亿美元，预计2025年达36.47亿美元。2018年国内市场规模1.45亿美元，预计2025年达2.07亿美元。发行人国产品牌市场份额首位，并率先推出基于物联网的疫苗、血液解决方案。,79,105,105,0,6,69,18,8,3,1,4,0.0380952380952381,4,0,1.3904761904761904,,49.41772151898734,107,42,27.4077868852459,10.758196721311474
688139_1206999086_tok_chunk_0005,688139,海尔生物,1206999086,star_token_proxy_150_20260630,5,10,results/star_token_proxy_250_late50_20260702/chunks/688139_1206999086_tok_chunk_0005.txt,3978,8584,7956,231,232,"2018年发行人营业收入84,166.86万元、净利润11,470.26万元，高于中科美菱和澳柯玛超低温。2018年发行人研发人员212人，研发投入9,035.39万元，占收入10.74%。发行人全球市场占有率约3.43%，国产品牌收入、利润和市场占有率居首。发行人14款超低温保存箱获美国能源之星认证，其中8款能耗低于0.35千瓦时/24小时/立方尺。发行人冰衬系列10项、太阳能系列8项产品入选WHO PQS采购目录。公司拥有187项专利，其中发明专利32项。",116,88,88,0,4,22,34,15,9,4,13,0.1477272727272727,6,-7,2.1704545454545454,,34.293103448275865,194,77,48.76822523881347,19.356460532931123
688139_1206999086_tok_chunk_0006,688139,海尔生物,1206999086,star_token_proxy_150_20260630,6,10,results/star_token_proxy_250_late50_20260702/chunks/688139_1206999086_tok_chunk_0006.txt,3974,9671,7948,265,265,"2019年1-3月发行人总产能21,250台，产量19,179台，产能利用率90.25%，销量18,699台。2018年产能85,000台，产量62,151台，销量70,233台。2018年前五大客户销售15,836.52万元，占主营业务收入19.17%，不存在单一客户重大依赖。2018年经销收入62,856.93万元，占76.07%；直销收入19,771.11万元，占23.93%。2018年前五大供应商采购额11,795.54万元，占采购比例32.69%。2018年向海尔集团采购2,072.25万元，占采购比例5.74%。",133,83,83,0,6,2,28,24,17,6,23,0.2771084337349397,6,-17,2.746987951807229,,29.8796992481203,35,2,8.807247106190236,0.5032712632108707
688139_1206999086_tok_chunk_0007,688139,海尔生物,1206999086,star_token_proxy_150_20260630,7,10,results/star_token_proxy_250_late50_20260702/chunks/688139_1206999086_tok_chunk_0007.txt,3873,8917,7745,268,268,"报告期内发行人向重合供应商采购金额分别为16,162.43万元、21,697.68万元、22,242.48万元和5,992.17万元。相关原材料型号与海尔集团关联方重合的采购占比分别为19.22%、15.50%、11.98%和11.83%。发行人及关联方独立与主要供应商签署采购合同，标准化原材料主要价格和结算条款不存在较大差异。发行人租赁9处境内主要房产，其中7处产权证书不全，海尔集团和控股方承诺补偿相关损失。海特生物取得53,333.3平方米工业用地，使用权至2067年9月7日。发行人及子公司拥有187项专利、27项软件著作权。",134,78,78,0,4,1,28,23,17,5,22,0.282051282051282,6,-16,2.8076923076923075,,28.902985074626866,76,51,19.62303124193132,13.168086754453912
688139_1206999086_tok_chunk_0008,688139,海尔生物,1206999086,star_token_proxy_150_20260630,8,10,results/star_token_proxy_250_late50_20260702/chunks/688139_1206999086_tok_chunk_0008.txt,3616,8058,7232,271,271,"发行人生产销售的Ⅱ类、Ⅲ类医疗器械收入合计2018年为67,322.34万元，占主营业务收入81.48%。截至招股说明书签署日，发行人持有14项医疗器械产品注册证书和1项备案文件。发行人“低温冰箱系列化产品关键技术及产业化”获2013年国家科学技术进步二等奖。发行人形成九大核心技术，覆盖低温制冷、HC制冷剂、低温换热、温控、液氮、生物安全、物联网和自动化存取。2018年及2019年1-3月，物联网低温存储设备销售收入分别为3,166.26万元和1,208.69万元。发行人核心技术对应专利包括样本库、疫苗、血液等物联网管理系统软件著作权。",136,81,81,0,5,0,20,23,22,11,33,0.4074074074074074,6,-27,3.111111111111111,,26.58823529411765,118,52,32.63274336283186,14.380530973451327
688139_1206999086_tok_chunk_0009,688139,海尔生物,1206999086,star_token_proxy_150_20260630,9,10,results/star_token_proxy_250_late50_20260702/chunks/688139_1206999086_tok_chunk_0009.txt,3981,9205,7962,236,236,"发行人九大核心技术均已产业化或进入市场导入，并对应多项专利。2019年1月海尔集团无偿放弃与发行人共有的75项专利共有权及1项专利申请权。2018年发行人依靠核心技术产生收入63,327.35万元，占主营业务收入76.64%。2018年核心技术医疗器械产品收入60,329.29万元，占医疗器械产品收入89.61%。发行人参与制定WHO太阳能疫苗冰箱国际标准，并牵头或参与多项低温保存箱、血液冷藏箱、药品冷藏箱行业标准。发行人航天专用冰箱连续参与神舟八号至十一号飞行任务。",118,88,88,0,3,1,17,27,28,12,40,0.4545454545454545,6,-34,3.272727272727273,,33.73728813559322,251,103,63.04948505400654,25.872896257221804
688139_1206999086_tok_chunk_0010,688139,海尔生物,1206999086,star_token_proxy_150_20260630,10,10,results/star_token_proxy_250_late50_20260702/chunks/688139_1206999086_tok_chunk_0010.txt,3602,8155,7204,262,262,"2018年发行人研发支出9,035.39万元，占营业收入10.74%；2019年1-3月研发支出2,169.29万元，占10.79%。公司在研项目覆盖生物样本库、药品试剂、疫苗安全和血液安全，物联网疫苗箱、物联网血液箱等部分产品已上市。截至2019年3月31日，发行人研发人员201人，本科及以上占88.06%。2018年研发人员平均薪酬22.34万元，接近同行业可比公司平均水平。公司6名核心技术人员平均任职12年，并均纳入2017年股权激励。2018年境外主营业务收入21,276.15万元，占主营业务收入25.75%。",131,69,69,0,5,1,18,19,18,8,26,0.3768115942028985,6,-20,2.9855072463768115,,27.49618320610687,381,149,105.77456968350917,41.36590782898389
688141_1215398751_tok_chunk_0001,688141,杰华特,1215398751,star_remaining_251_543_20260702,1,9,results/star_token_proxy_full_2019_2023_20260702/chunks/688141_1215398751_tok_chunk_0001.txt,3969,8842,7937,216,216,"公司采用虚拟IDM模式研发销售模拟集成电路，工信部认定为专精特新“小巨人”。报告期内工业及通讯领域销售占比由20%左右升至50%左右。2022年6月末公司拥有401项专利、146项发明专利和49项集成电路布图设计登记证书。报告期内累计研发投入超5亿元，各期占营业收入15%以上；研发人员341名，占员工总数55%以上。公司拥有1,000款以上可销售芯片、600款以上在研型号，产品进入海康威视、中兴、小米通讯、新华三、荣耀等供应链。",108,86,86,0,8,12,26,27,10,3,13,0.1511627906976744,5,-8,2.3255813953488373,,36.75,153,90,38.548752834467116,22.675736961451246
688141_1215398751_tok_chunk_0002,688141,杰华特,1215398751,star_remaining_251_543_20260702,2,9,results/star_token_proxy_full_2019_2023_20260702/chunks/688141_1215398751_tok_chunk_0002.txt,3929,8666,7858,145,145,公司采取虚拟IDM模式，研发以电路、版图设计与工艺开发并重，并基于专有PDK进行设计。公司已在国内主要晶圆厂构建三大类工艺平台，初步形成系统自研工艺体系。公司产品研发分新品立项、研发设计、晶圆流片、封装测试和量产认证五阶段。公司已具备国际先进、基于国内主要晶圆厂产线资源的自主工艺制造技术。,73,78,78,0,7,20,29,14,7,1,8,0.1025641025641025,4,-4,1.9615384615384617,,53.821917808219176,289,148,73.555612115042,37.66861796894884
688141_1215398751_tok_chunk_0003,688141,杰华特,1215398751,star_remaining_251_543_20260702,3,9,results/star_token_proxy_full_2019_2023_20260702/chunks/688141_1215398751_tok_chunk_0003.txt,3964,8648,7928,261,261,公司高压BCD第一代工艺2017年中启动、2018年中完成，部分量产高压芯片填补国内空白。公司超高压BCD工艺适用于AC-DC产品，已量产高频GaN的ACF控制器等产品。公司构建0.18微米7至55V中低压BCD、0.18微米10至200V高压BCD、0.35微米10至700V超高压BCD三大工艺平台。公司BCD工艺已形成22项发明专利和17项实用新型专利。公司通过ISO9001、ISO14001认证，并建立汽车电子AECQ100资格认证体系。公司现已通过质量要求进入海康威视、中兴、小米通讯、新华三、荣耀等客户体系。,131,82,82,0,9,16,27,18,9,3,12,0.1463414634146341,6,-6,2.1341463414634148,,30.259541984732824,181,89,45.660948536831484,22.45206861755802
688141_1215398751_tok_chunk_0004,688141,杰华特,1215398751,star_remaining_251_543_20260702,4,9,results/star_token_proxy_full_2019_2023_20260702/chunks/688141_1215398751_tok_chunk_0004.txt,3990,9162,7979,137,137,"公司专注模拟集成电路设计研发，依托自研工艺和设计能力推动国产替代。2020年全球集成电路销售额为3,612.26亿美元，2021年中国集成电路产业销售额为10,458亿元。模拟集成电路平均学习曲线10至15年，主要制程以180纳米/130纳米为主，产品生命周期可长达10年。",69,74,74,0,6,48,12,5,3,0,3,0.0405405405405405,3,0,1.337837837837838,,57.82608695652174,62,33,15.538847117794486,8.270676691729323
